{
  "$schema": "../package-request.schema.json",
  "schema_version": 1,
  "package_id": "marksans-curated-overview-2025",
  "name": "Marksans Pharma Financial Model & 5-Slide Executive Overview",
  "description": "Repeatable template-driven package generating reconciled Excel financial model and 5-slide PowerPoint deck from originals/ERR-4.pptx.",
  "company": {
    "name": "Marksans Pharma Ltd.",
    "ticker": "MARKSANS",
    "exchange": "NSE / BSE",
    "bse_code": "524404",
    "valuation_date": "2025-10-05",
    "historical_cutoff": "FY25",
    "currency": "INR",
    "reporting_unit": "INR_Cr",
    "fiscal_year_convention": "April-March",
    "source_documents": [
      {
        "title": "Marksans Pharma Limited 33rd Annual Report FY 2024-25",
        "type": "Annual Report",
        "period": "FY25 (ended 2025-03-31)",
        "basis": "consolidated",
        "url_or_path": "originals/Marksans Keshav.xlsx [Data Sheet, BS, Cash Flow]"
      },
      {
        "title": "Marksans Pharma Investor Presentation FY25 / Q4FY25",
        "type": "Investor Presentation",
        "period": "FY25",
        "basis": "consolidated",
        "url_or_path": "originals/Marksans Keshav.xlsx [Main Financials]"
      },
      {
        "title": "Screener.in Financial Snapshot",
        "type": "Market Data Aggregator",
        "period": "2025-10-05 snapshot (Trading close 2025-10-03)",
        "basis": "consolidated",
        "url_or_path": "originals/Marksans Keshav.xlsx [WACC-DCF]"
      }
    ],
    "source_data": {
      "user_supplied_facts": {
        "current_market_price": 309.10,
        "shares_outstanding_cr": 45.30,
        "market_capitalization_cr": 14002.74,
        "total_borrowings_cr": 343.38
      },
      "source_extracted_facts": {
        "revenue_operations_fy25_cr": 2622.85,
        "operating_profit_ebitda_fy25_cr": 569.21,
        "pbt_fy25_cr": 503.96,
        "net_profit_pat_fy25_cr": 380.58,
        "cash_from_operations_fy25_cr": 206.66,
        "capex_net_fy25_cr": -172.00,
        "cash_from_investing_fy25_cr": -49.01,
        "cash_from_financing_fy25_cr": -65.15,
        "net_cash_flow_fy25_cr": 92.51,
        "current_ratio_fy25": 4.95,
        "quick_ratio_fy25": 3.07
      },
      "analyst_assumptions": {
        "risk_free_rate_pct": 7.30,
        "equity_risk_premium_pct": 9.07,
        "total_market_return_pct": 16.37,
        "raw_peer_beta": 0.547,
        "pre_tax_cost_of_debt_pct": 8.00,
        "marginal_tax_rate_pct": 30.00,
        "target_debt_weight_pct": 2.24,
        "target_equity_weight_pct": 97.76
      },
      "calculated_outputs": {
        "cost_of_equity_pct": 12.26,
        "post_tax_cost_of_debt_pct": 5.60,
        "weighted_average_cost_of_capital_pct": 12.11,
        "target_d_to_e_ratio": 0.0229,
        "intrinsic_value_per_share_inr": 348.60
      },
      "unresolved_inputs": {
        "slide1_geographic_revenue_mix": "Primary filing regional segmentation [43.1%, 41.7%, 9.8%, 5.4%] is not evidenced in uploaded originals; chart title set to 'Unavailable — Pending Primary Filing' and series marked unverified."
      }
    },
    "forecast_assumptions": {
      "forecast_horizon_years": 5,
      "terminal_growth_rate_pct": 5.0,
      "ebitda_margin_target_pct": 21.7
    }
  },
  "workbook": {
    "source": "originals/Marksans Keshav.xlsx",
    "source_sha256": "5a1f9af7d1be9f5a68c9be5927017f3be6fd421399b6951a5b9c17d6455b462a",
    "model_pack": "proposals/marksans.model-pack.proposal.json",
    "output_name": "Marksans-Recalculated.xlsx",
    "expected_recalculated_sha256": "ef5d6d5acb66e771abcb23df8151ff7835958d7a3c7e79452d088e314cbddd85"
  },
  "presentation": {
    "template": "originals/ERR-4.pptx",
    "template_sha256": "9d41ec99b9a4d0426ce4e2ab6174604859bb6a406aa82a2cd690431a36c298ba",
    "deck_pack": "proposals/err4.deck-pack.proposal.json",
    "deck_inputs": "proposals/err4.inputs.proposal.json",
    "output_name": "Marksans-Pharma-Overview.pptx",
    "selected_slides": [1, 2, 14, 16, 23]
  },
  "exports": {
    "export_slide_pngs": true,
    "png_width": 1080,
    "png_height": 1440,
    "export_sheet_pdfs": true,
    "pdf_sheets": [
      "Data Sheet",
      "Ratio Analysis",
      "Intrinsic Growth",
      "WACC-DCF",
      "DCF 1st way",
      "DCF 2nd way"
    ],
    "pdf_orientation": "landscape",
    "pdf_fit_to_page_wide": 1
  }
}
